{
  "schema": "ee-fund-mgr/portfolio-ocr@1",
  "platform": "微信理财通",
  "screenshot_date": "2026-05-08",
  "items": [
    {
      "name": "朝朝宝",
      "code": null,
      "asset_type": "money_fund",
      "shares": null,
      "amount": 12345.67,
      "avg_cost": null,
      "current_price": null,
      "market_value": 12345.67,
      "profit": 12.34,
      "profit_pct": null,
      "yield_7d": 1.85,
      "expected_apr": null,
      "maturity_date": null
    },
    {
      "name": "兴全合宜混合(LOF)",
      "code": "163417",
      "asset_type": "fund",
      "shares": 1234.5678,
      "amount": null,
      "avg_cost": 1.234,
      "current_price": 1.345,
      "market_value": 1660.49,
      "profit": 137.13,
      "profit_pct": 9.0,
      "yield_7d": null,
      "expected_apr": null,
      "maturity_date": null
    },
    {
      "name": "易方达蓝筹精选混合",
      "code": "005827",
      "asset_type": "fund",
      "shares": 5000.0,
      "amount": null,
      "avg_cost": 2.5,
      "current_price": 2.31,
      "market_value": 11550.0,
      "profit": -950.0,
      "profit_pct": -7.6,
      "yield_7d": null,
      "expected_apr": null,
      "maturity_date": null
    },
    {
      "name": "贵州茅台",
      "code": "600519",
      "asset_type": "stock",
      "shares": 10,
      "amount": null,
      "avg_cost": 1680.0,
      "current_price": 1722.5,
      "market_value": 17225.0,
      "profit": 425.0,
      "profit_pct": 2.53,
      "yield_7d": null,
      "expected_apr": null,
      "maturity_date": null
    },
    {
      "name": "招银理财·招睿180天封闭式",
      "code": null,
      "asset_type": "wealth",
      "shares": null,
      "amount": 50000.0,
      "avg_cost": null,
      "current_price": null,
      "market_value": 50762.33,
      "profit": 762.33,
      "profit_pct": 1.52,
      "yield_7d": null,
      "expected_apr": 3.5,
      "maturity_date": "2026-08-15"
    }
  ]
}
